{
  "$comment": "J2.4 causality fixture: two effort sources on one 0-junction. Both Se elements have fixed effort-out causality, so both must impose the effort on the junction; the second one is E106. The junction supplies two equations and the two Se blocks one each, so the model balances (4 unknowns, 4 equations).",
  "format": "bgsim.model",
  "language": "0.1.0",
  "name": "SeSeConflict",
  "diagram": {
    "nodes": [
      {
        "id": "n1",
        "name": "Se1",
        "block": { "ref": "stdlib:bondgraph/Se" },
        "position": { "x": 80, "y": 80 },
        "rotation": 0,
        "flipX": false,
        "params": { "e": "1.0" },
        "constants": {},
        "starts": {},
        "ui": { "showLabel": true, "color": null }
      },
      {
        "id": "n2",
        "name": "J0",
        "block": { "junction": "0" },
        "position": { "x": 320, "y": 200 },
        "rotation": 0,
        "flipX": false,
        "params": {},
        "constants": {},
        "starts": {},
        "ui": { "showLabel": true, "color": null }
      },
      {
        "id": "n3",
        "name": "Se2",
        "block": { "ref": "stdlib:bondgraph/Se" },
        "position": { "x": 80, "y": 320 },
        "rotation": 0,
        "flipX": false,
        "params": { "e": "2.0" },
        "constants": {},
        "starts": {},
        "ui": { "showLabel": true, "color": null }
      }
    ],
    "connections": [
      {
        "id": "c1",
        "kind": "bond",
        "from": { "node": "n1", "port": "p" },
        "to": { "node": "n2" },
        "route": [],
        "label": null
      },
      {
        "id": "c2",
        "kind": "bond",
        "from": { "node": "n3", "port": "p" },
        "to": { "node": "n2" },
        "route": [],
        "label": null
      }
    ],
    "subsystemPorts": [],
    "annotations": []
  },
  "settings": {
    "t_start": 0.0,
    "t_end": 0.01,
    "solver": "auto",
    "reltol": 1e-8,
    "abstol": 1e-10,
    "max_step": null,
    "output": { "mode": "points", "points": 100 },
    "event_limit": 10000
  },
  "plots": [],
  "scene": null,
  "bindings": []
}
